<?xml version="1.0" encoding="UTF-8" standalone="yes"?><gems xmlns:xsi="http://www.w3.org/2001/XMLSchema-instance" xsi:noNamespaceSchemaLocation="diamondFundSchema.xsd"><gemstone id="TT-10"><name>Yantar</name><preciosness>COMMON</preciosness><origin>Kiev</origin><visualParameters><color>RED</color><transparency>0.5</transparency><verges>6</verges></visualParameters><value>10</value></gemstone></gems>