<?xml version="1.0" encoding="UTF-8" standalone="yes"?><gems xmlns:xsi="http://www.w3.org/2001/XMLSchema-instance" xsi:noNamespaceSchemaLocation="diamondFundSchema.xsd"><gemstone id="TT-12"><name>Diamond</name><preciosness>PRECIOUS</preciosness><origin>Kiev</origin><visualParameters><color>RED</color><transparency>0.4</transparency><verges>4</verges></visualParameters><value>4</value></gemstone><gemstone id="TT-15"><name>Topaz</name><preciosness>SEMIPRECIOUS</preciosness><origin>Lviv</origin><visualParameters><color>BLUE</color><transparency>0.6</transparency><verges>10</verges></visualParameters><value>5</value></gemstone></gems>